AT5G05460,"Glycosyl hydrolase family 85 ; FUNCTIONS IN: hydrolase activity, acting on glycosyl bonds, mannosyl-glycoprotein endo-beta-N-acetylglucosaminidase activity; INVOLVED IN: biological_process unknown; LOCATED IN: chloroplast, cytoplasm; EXPRESSED IN: 18 plant structures; EXPRESSED DURING: 12 growth stages; CONTAINS InterPro DOMAIN/s: Glycoside hydrolase, family 85 (InterPro:IPR005201), Glycoside hydrolase, catalytic core (InterPro:IPR017853); BEST Arabidopsis thaliana protein match is: Glycosyl hydrolase family 85  (TAIR:AT3G11040.1); Has 480 Blast hits to 472 proteins in 209 species: Archae - 0; Bacteria - 262; Metazoa - 108; Fungi - 28; Plants - 47; Viruses - 0; Other Eukaryotes - 35 (source: NCBI BLink).","ENDO-BETA-N-ACETYGLUCOSAMINIDASE 85A (ENGase85A)"," ",3,6,0,0,0.157589774,0.119626687,0.095182021,0.026864897,0.076346125,0.399002161,0.033340917,0.030167565,0.032538398,0.029341455,0.294492694,0.191343186,0.101017211,0.067287333,0.054091205,0.045360055,0.09975563,0.034228322,0.035590686,0.076833678
AT2G04170,"TRAF-like family protein; CONTAINS InterPro DOMAIN/s: TRAF-like (InterPro:IPR008974), MATH (InterPro:IPR002083); BEST Arabidopsis thaliana protein match is: TRAF-like family protein (TAIR:AT5G26280.1); Has 35333 Blast hits to 34131 proteins in 2444 species: Archae - 798; Bacteria - 22429; Metazoa - 974; Fungi - 991; Plants - 531; Viruses - 0; Other Eukaryotes - 9610 (source: NCBI BLink)."," "," ",6,6,0,0,0.147434944,0.100674119,0.096852973,0.096877721,0.089354291,0.106709798,0.09158395,0.086473652,0.094983393,0.08905516,0.123741405,0.092086703,0.080626278,0.072153329,0.092799967,0.084206983,0.150606883,0.113310509,0.100839094,0.089628848
AT1G72150,"novel cell-plate-associated protein that is related in sequence to proteins involved in membrane trafficking in other eukaryotes","PATELLIN 1 (PATL1)"," ",12,12,0,0,0.124617859,0.135198127,0.122846631,0.103488141,0.093686122,0.095911278,0.093485701,0.080661007,0.080255304,0.06984983,0.099591064,0.12172621,0.122632297,0.111739361,0.101585551,0.093567444,0.140309123,0.075725348,0.073243327,0.059880274
AT5G07350,"RNA binding protein with nuclease activity essential for stress response. Involved in mechanisms acting  on mRNAs entering the secretory pathway. Functionally redundant with TSN2.","TUDOR-SN PROTEIN 1 (TUDOR1)"," ",24,25,0,0,0.043600133,0.060654127,0.073109001,0.085698469,0.094346841,0.096827495,0.132333931,0.136673894,0.13992772,0.136828389,0.048944205,0.053775273,0.060174858,0.071833428,0.082795794,0.093985289,0.154131071,0.150777658,0.138686363,0.14489606
AT5G39040,"Encodes a member of TAP subfamily of ABC transporters that is located in the vacuole.  Mutants are hypersensitive to aluminum and the gene product may be important for intracellular movement of some substrate, possibly chelated Al, as part of a mechanism of aluminum sequestration.","ATP-BINDING CASSETTE B27 (ABCB27)",Vacuole,5,6,0,0,0.282393361,0.217099054,0.122104712,0.088693649,0.066527398,0.064807597,0.038656124,0.045637747,0.038400022,0.035680336,0.310193149,0.180035305,0.099663069,0.072006017,0.060275837,0.057161309,0.101669599,0.044191261,0.036406363,0.038398091
AT5G39620,"RAB GTPase homolog G1 (RABG1); FUNCTIONS IN: GTP binding; INVOLVED IN: protein transport, small GTPase mediated signal transduction; CONTAINS InterPro DOMAIN/s: Ras GTPase (InterPro:IPR001806), Small GTP-binding protein (InterPro:IPR005225), Small GTPase (InterPro:IPR020851), Ras (InterPro:IPR013753), Ras small GTPase, Rab type (InterPro:IPR003579); BEST Arabidopsis thaliana protein match is: RAB GTPase homolog 7A (TAIR:AT2G21880.1); Has 30201 Blast hits to 17322 proteins in 780 species: Archae - 12; Bacteria - 1396; Metazoa - 17338; Fungi - 3422; Plants - 5037; Viruses - 0; Other Eukaryotes - 2996 (source: NCBI BLink).","RAB GTPASE HOMOLOG G1 (RABG1)"," ",3,3,0,0,0.058689804,0.071076334,0.078103872,0.130525793,0.132503126,0.137665789,0.09101901,0.103225899,0.088748939,0.108441434,0.087026142,0.076070777,0.087553667,0.015896112,0.108615553,0.110543025,0.095844967,0.156539006,0.145609792,0.116300959
AT5G43600,"Encodes a protein with ureidoglycolate amidohydrolase activity in vitro. It is 27% identical and 43% similar to the E. coli allantoate amidohydrolase (AAH), but, in vitro assays with purified protein and allantoate as a substrate do not show any increase in ammonium concentration, indicating that there this enzyme has no AAH activity.","UREIDOGLYCOLATE AMIDOHYDROLASE (UAH)"," ",7,11,0,0,0.174065475,0.193852458,0.157397865,0.113392704,0.088930185,0.077280555,0.053094199,0.050975158,0.040918639,0.05009276,0.157148014,0.155569782,0.133367535,0.104786403,0.077193238,0.074150648,0.108861577,0.061479476,0.074364511,0.053078816
AT1G17290,"Encodes for alanine aminotransferase (ALAAT1), involved in alanine catabolism during plants recovery from hypoxia","ALANINE AMINOTRANSFERAS (AlaAT1)"," ",10,12,0,0,0.043583127,0.032287805,0.039828912,0.039236201,0.049129734,0.071300396,0.152414523,0.188793647,0.178369809,0.205055845,0.044075393,0.03168172,0.030917563,0.037377145,0.049169625,0.066932844,0.194508022,0.176050509,0.179026959,0.19026022
AT1G04480,"Ribosomal protein L14p/L23e family protein; FUNCTIONS IN: structural constituent of ribosome; INVOLVED IN: translation; LOCATED IN: ribosome, intracellular; EXPRESSED IN: 24 plant structures; EXPRESSED DURING: 15 growth stages; CONTAINS InterPro DOMAIN/s: Ribosomal protein L14b/L23e (InterPro:IPR000218), Ribosomal protein L14 conserved site (InterPro:IPR019972); BEST Arabidopsis thaliana protein match is: Ribosomal protein L14p/L23e family protein (TAIR:AT3G04400.1); Has 9301 Blast hits to 9300 proteins in 3178 species: Archae - 321; Bacteria - 5427; Metazoa - 383; Fungi - 266; Plants - 815; Viruses - 0; Other Eukaryotes - 2089 (source: NCBI BLink)."," ",Ribosome,4,6,0,0,0.152049739,0.175014446,0.156995639,0.133810449,0.091571164,0.078044761,0.063139132,0.053752351,0.049699434,0.045922885,0.197241223,0.179316918,0.121750746,0.089726515,0.077007078,0.05744051,0.15419362,0.035976731,0.037078364,0.050268294
AT1G30400,"glutathione S-conjugate transporting ATPase (AtMRP1) mRNA. An ABCC-type arsenite-phytochelatin transporter. The expression of this gene is upregulated by herbicide safeners such as benoxacor and fenclorim.","ATP-BINDING CASSETTE C1 (ABCC1)",Vacuole,9,13,0,0,0.339867306,0.178703217,0.126330955,0.102545792,0.070268444,0.061801076,0.033456746,0.027112768,0.031579286,0.02833441,0.360337104,0.227771434,0.115291135,0.067926601,0.066149203,0.051652927,0.037463519,0.021138315,0.014048957,0.038220805
AT2G36290,"alpha/beta-Hydrolases superfamily protein; FUNCTIONS IN: hydrolase activity; INVOLVED IN: biological_process unknown; LOCATED IN: endoplasmic reticulum; EXPRESSED IN: 24 plant structures; EXPRESSED DURING: 13 growth stages; CONTAINS InterPro DOMAIN/s: Alpha/beta hydrolase fold-1 (InterPro:IPR000073); BEST Arabidopsis thaliana protein match is: alpha/beta-Hydrolases superfamily protein (TAIR:AT1G74300.1); Has 970 Blast hits to 968 proteins in 224 species: Archae - 20; Bacteria - 476; Metazoa - 0; Fungi - 77; Plants - 313; Viruses - 0; Other Eukaryotes - 84 (source: NCBI BLink)."," "," ",5,7,0,0,0.151610292,0.14878569,0.15626411,0.155650404,0.137452896,0.113969044,0.037299617,0.032740869,0.029948465,0.036278613,0.118123085,0.144669333,0.134216905,0.128415238,0.104591013,0.089630232,0.111244604,0.058768477,0.059083992,0.051257121
AT1G55020,"lipoxygenase, a defense gene conferring resistance Xanthomonas campestris","LIPOXYGENASE 1 (LOX1)"," ",24,24,0,0,0.069888061,0.064755864,0.072952917,0.09195314,0.093395584,0.1090587,0.108305665,0.122392401,0.137540389,0.12975728,0.070340317,0.073789872,0.080285365,0.080088644,0.091127196,0.10116874,0.125447064,0.129607711,0.129364999,0.118780093
AT2G47710,"Adenine nucleotide alpha hydrolases-like superfamily protein; FUNCTIONS IN: molecular_function unknown; INVOLVED IN: response to stress; LOCATED IN: vacuole; EXPRESSED IN: 23 plant structures; EXPRESSED DURING: 13 growth stages; CONTAINS InterPro DOMAIN/s: UspA (InterPro:IPR006016), Rossmann-like alpha/beta/alpha sandwich fold (InterPro:IPR014729), Universal stress protein A (InterPro:IPR006015); BEST Arabidopsis thaliana protein match is: unknown protein (TAIR:AT5G49050.1); Has 2830 Blast hits to 2747 proteins in 619 species: Archae - 112; Bacteria - 1833; Metazoa - 129; Fungi - 32; Plants - 667; Viruses - 0; Other Eukaryotes - 57 (source: NCBI BLink)."," "," ",3,3,0,0,0.124880444,0.096384085,0.123874792,0.101814735,0.112984004,0.145809881,0.093501269,0.106849699,0.07342048,0.020480612,0.094995668,0.094025507,0.079135512,0.090097037,0.107568323,0.110866196,0.146774604,0.068141465,0.083234593,0.125161095
AT1G66240,"homolog of anti-oxidant 1 (ATX1); FUNCTIONS IN: metal ion binding; INVOLVED IN: metal ion transport; LOCATED IN: endomembrane system; EXPRESSED IN: 22 plant structures; EXPRESSED DURING: 13 growth stages; CONTAINS InterPro DOMAIN/s: Heavy metal transport/detoxification protein (InterPro:IPR006121); BEST Arabidopsis thaliana protein match is: copper chaperone (TAIR:AT3G56240.1); Has 1720 Blast hits to 1673 proteins in 288 species: Archae - 4; Bacteria - 215; Metazoa - 140; Fungi - 221; Plants - 1117; Viruses - 0; Other Eukaryotes - 23 (source: NCBI BLink).","HOMOLOG OF ANTI-OXIDANT 1 (ATX1)"," ",4,4,0,0,0.078325337,0.09944267,0.096048854,0.098394175,0.094279377,0.099789517,0.127196707,0.085074703,0.134121665,0.087326995,0.088783442,0.088314899,0.105635266,0.101413202,0.114309475,0.121869284,0.08777145,0.082732897,0.11614808,0.093022006
AT1G56580,"Encodes SMALLER WITH VARIABLE BRANCHES (SVB), a protein with a conserved domain of unknown function (DUF538).  The trichomes of the SVB mutants are smaller and exhibit branches of variable length and number.","SMALLER WITH VARIABLE BRANCHES (SVB)"," ",2,3,0,0,0.132343424,0.12406575,0.121329848,0.124465845,0.099937388,0.077335739,0.096701244,0.083078891,0.072355775,0.068386096,0.154273018,0.15216464,0.127981902,0.116285599,0.086342148,0.057776414,0.117472774,0.073706075,0.069276979,0.044720452
AT3G48930,"embryo defective 1080 (EMB1080); FUNCTIONS IN: structural constituent of ribosome; INVOLVED IN: translation, embryo development ending in seed dormancy; LOCATED IN: cytosolic small ribosomal subunit, cytosolic ribosome, cell wall, membrane; EXPRESSED IN: 22 plant structures; EXPRESSED DURING: 13 growth stages; CONTAINS InterPro DOMAIN/s: Nucleic acid-binding, OB-fold-like (InterPro:IPR016027), Nucleic acid-binding, OB-fold (InterPro:IPR012340), Ribosomal protein S17, archaeal (InterPro:IPR019978), Ribosomal protein S17, conserved site (InterPro:IPR019979), Ribosomal protein S17 (InterPro:IPR000266); BEST Arabidopsis thaliana protein match is: ribosomal protein S11-beta (TAIR:AT5G23740.1); Has 1290 Blast hits to 1288 proteins in 469 species: Archae - 240; Bacteria - 242; Metazoa - 305; Fungi - 148; Plants - 140; Viruses - 0; Other Eukaryotes - 215 (source: NCBI BLink).","EMBRYO DEFECTIVE 1080 (EMB1080)",Ribosome,3,2,0,1,0.164254326,0.162827012,0.079360144,0.121702562,0.111497911,0.103487165,0.054846811,0.08055599,0.067935628,0.053532451,0.143119375,0.142160242,0.096740773,0.102647809,0.087556758,0.10480701,0.17925807,0,0.061950081,0.081759884
AT4G14880,"Encodes a cytosolic isoform of cytosolic O-acetylserine(thiol)lyase, a key enzyme in cysteine biosynthesis and for the fixation of inorganic sulfide. It catalyzes the formation of cysteine from O-acetylserine and inorganic sulfide. Gene expression is predominant in the root cortex and the xylem parenchyma.  Gene expression is induced in leave, stems and roots by high salt and heavy metal stresses, mediated by ABA. Lines carrying semi-dominant mutations exhibit early senescence.","O-ACETYLSERINE (THIOL) LYASE (OAS-TL) ISOFORM A1 (OASA1)",Cytosol,7,6,0,0,0.076878061,0.053567314,0.030011267,0.051804731,0.096063735,0.0817351,0.133193596,0.165023148,0.159694165,0.152028883,0.074522409,0.052748457,0.048533256,0.058531096,0.078892442,0.09682329,0.128877546,0.150039309,0.149567857,0.161464338
AT3G06050,"Encodes a mitochondrial matrix localized peroxiredoxin involved in redox homeostasis. Knockout mutants have reduced root growth under certain oxidative stress conditions.","PEROXIREDOXIN IIF (PRXIIF)"," ",6,7,0,0,0.021600631,0.035496305,0.048245807,0.058022747,0.077534739,0.101322575,0.153240494,0.176331197,0.159358464,0.16884704,0.025355555,0.03678144,0.050310568,0.065182955,0.078779422,0.105124144,0.113155943,0.179197808,0.18029295,0.165819215
AT1G27450,"Adenosine phosphoribosyl transferase(E.C:2.4.2.7), involved in the one-step salvage of adenine to AMP.","ADENINE PHOSPHORIBOSYL TRANSFERASE 1 (APT1)"," ",6,5,0,0,0.075506182,0.09668083,0.100571892,0.122290007,0.113408057,0.120707735,0.114202768,0.08578839,0.093032808,0.077811331,0.077318819,0.068005066,0.064671735,0.085512228,0.084050712,0.103666176,0.205901828,0.097002367,0.084415366,0.129455703
AT5G12200,"Encodes a protein with dihydropyrimidine amidohydrolase activity. It localizes to the secretory system and plays a role in uracil metabolism.","PYRIMIDINE 2 (PYD2)",ER,8,10,0,0,0.162023453,0.181457678,0.143132076,0.125617492,0.098508639,0.080803082,0.05878564,0.055200709,0.049294872,0.045176362,0.158951138,0.155862457,0.138279117,0.104948165,0.087147189,0.080062803,0.089594227,0.057450698,0.070251127,0.057453078
AT1G11890,"member of SEC22 Gene Family","SECRETION 22 (SEC22)",ER,3,5,0,0,0.099702112,0.13923588,0.155324705,0.133320796,0.119070725,0.146938233,0.032114319,0.086417535,0.046484077,0.041391618,0.084211238,0.138753723,0.14010136,0.144758598,0.09544771,0.079170338,0.025556986,0.046177834,0.140652396,0.105169816
AT1G23170,"Protein of unknown function DUF2359, transmembrane; FUNCTIONS IN: molecular_function unknown; INVOLVED IN: biological_process unknown; CONTAINS InterPro DOMAIN/s: Protein of unknown function DUF2359, transmembrane (InterPro:IPR019308); BEST Arabidopsis thaliana protein match is: Protein of unknown function DUF2359, transmembrane (TAIR:AT1G70770.2)."," "," ",3,2,0,0,0.180344577,0.110693143,0.077382707,0.089087231,0.092438083,0.061879451,0.111219767,0.06552152,0.111359803,0.100073717,0.098451422,0.134258047,0.141553815,0.124684117,0.097305356,0.074049621,0.124452576,0.074178791,0.079486899,0.051579356
AT1G59610,"A high molecular weight GTPase whose GTP-binding domain shows a low homology to those of other plant dynamin-like proteins.Contains a pleckstrin homologous domain. DRP2B and DRP1A participate together in clathrin-coated vesicle formation during endocytosis.","DYNAMIN-LIKE 3 (DL3)",PM,12,11,0,0,0.070100221,0.047083327,0.059246755,0.074052778,0.061408242,0.05274401,0.230469977,0.155153166,0.114773409,0.134968116,0.035689763,0.030093953,0.035861704,0.029736574,0.031797295,0.028528873,0.377263965,0.159055532,0.143129159,0.128843182
AT4G29350,"Encodes profilin2, a low-molecular weight, actin monomer-binding protein that regulates the organization of actin cytoskeleton. Expressed in vegetative organs. The first intron of PRF2 enhances gene expression.","PROFILIN 2 (PFN2)"," ",4,4,0,0,0.05192385,0.058317919,0.063315324,0.080885997,0.107390009,0.14665641,0.100100229,0.148883034,0.102022465,0.140504763,0.049619091,0.047564941,0.053767311,0.072501915,0.103145636,0.125123481,0.301554054,0.088684389,0.081247961,0.076791221
AT1G21880,"Encodes a lysin-motif protein mediating bacterial peptidoglycan sensing and immunity to bacterial infection. Induction of chitin-responsive genes by chitin treatment is not blocked in the mutant.","LYSM DOMAIN GPI-ANCHORED PROTEIN 1 PRECURSOR (LYM1)"," ",3,3,0,0,0.075515739,0.09398851,0.073629749,0.068900344,0.059668329,0.058645729,0.125931735,0.144350378,0.145931482,0.153438006,0.107311238,0.077216965,0.065648745,0.064801228,0.056615963,0.060377351,0.123893496,0.154543656,0.17013633,0.119455028
AT3G18190,"TCP-1/cpn60 chaperonin family protein; FUNCTIONS IN: unfolded protein binding, ATP binding; INVOLVED IN: response to cadmium ion; EXPRESSED IN: 24 plant structures; EXPRESSED DURING: 15 growth stages; CONTAINS InterPro DOMAIN/s: Chaperonin Cpn60/TCP-1 (InterPro:IPR002423), Chaperone, tailless complex polypeptide 1 (InterPro:IPR017998), Chaperonin TCP-1, conserved site (InterPro:IPR002194), T-complex protein 1, delta subunit (InterPro:IPR012717); BEST Arabidopsis thaliana protein match is: TCP-1/cpn60 chaperonin family protein (TAIR:AT1G24510.1); Has 19273 Blast hits to 19203 proteins in 3973 species: Archae - 808; Bacteria - 9512; Metazoa - 2051; Fungi - 1477; Plants - 841; Viruses - 2; Other Eukaryotes - 4582 (source: NCBI BLink)."," "," ",14,17,0,0,0.08698243,0.085157369,0.101372006,0.127074149,0.115615926,0.111493866,0.099200142,0.090082892,0.078477596,0.104543623,0.089354138,0.077680774,0.088080423,0.094315888,0.09391003,0.100871039,0.137026619,0.098779743,0.096063923,0.123917423
AT3G43190,"Encodes a protein with sucrose synthase activity (SUS4).","SUCROSE SYNTHASE 4 (SUS4)"," ",12,11,0,0,0.149749906,0.136593162,0.131343348,0.068860039,0.061575977,0.062645032,0.105196301,0.068606377,0.123330708,0.092099149,0.179466775,0.111054723,0.081512683,0.065695547,0.056961213,0.060670956,0.100573984,0.151448427,0.103536403,0.089079289
AT2G44100,"GDP dissociation inhibitor involved in vesicular membrane traffic","GUANOSINE NUCLEOTIDE DIPHOSPHATE DISSOCIATION INHIBITOR 1 (GDI1)"," ",4,4,0,0,0.067255592,0.084967319,0.079099595,0.069729723,0.07749084,0.098910597,0.170859639,0.138273762,0.09986539,0.113547545,0.090068008,0.054899069,0.044921113,0.064723135,0.073482627,0.055447753,0.210030396,0.106204004,0.142726735,0.15749716
AT5G20890,"TCP-1/cpn60 chaperonin family protein; FUNCTIONS IN: unfolded protein binding, ATP binding; INVOLVED IN: protein folding, cellular protein metabolic process; LOCATED IN: anchored to plasma membrane, cell wall; EXPRESSED IN: 24 plant structures; EXPRESSED DURING: 14 growth stages; CONTAINS InterPro DOMAIN/s: Chaperonin Cpn60/TCP-1 (InterPro:IPR002423), Chaperone, tailless complex polypeptide 1 (InterPro:IPR017998), T-complex protein 1, beta subunit (InterPro:IPR012716), Chaperonin TCP-1, conserved site (InterPro:IPR002194); BEST Arabidopsis thaliana protein match is: TCP-1/cpn60 chaperonin family protein (TAIR:AT3G11830.1); Has 19831 Blast hits to 19435 proteins in 3922 species: Archae - 807; Bacteria - 9602; Metazoa - 2181; Fungi - 1427; Plants - 861; Viruses - 0; Other Eukaryotes - 4953 (source: NCBI BLink)."," "," ",14,16,0,0,0.058182519,0.034880158,0.060417464,0.071146812,0.081778075,0.101604874,0.138697002,0.126628791,0.180992454,0.145671851,0.051067747,0.048587621,0.061422496,0.072626092,0.091232562,0.091238077,0.170981209,0.131959908,0.141159955,0.139724333
AT1G48030,"Encodes a mitochondrial lipoamide dehydrogenase whose expression is induced by light.","MITOCHONDRIAL LIPOAMIDE DEHYDROGENASE 1 (mtLPD1)"," ",8,9,0,0,0.033957483,0.046432133,0.067860318,0.082192261,0.108910701,0.122944574,0.121768428,0.186337778,0.107574283,0.122022043,0.026946485,0.040421931,0.049747928,0.066248131,0.071790973,0.104957245,0.177274883,0.158349085,0.171439385,0.132823954
AT5G20500,"Glutaredoxin family protein; FUNCTIONS IN: electron carrier activity, arsenate reductase (glutaredoxin) activity, protein disulfide oxidoreductase activity; INVOLVED IN: cell redox homeostasis; LOCATED IN: endomembrane system; EXPRESSED IN: 24 plant structures; EXPRESSED DURING: 15 growth stages; CONTAINS InterPro DOMAIN/s: Glutaredoxin (InterPro:IPR002109), Glutaredoxin active site (InterPro:IPR011767), Glutaredoxin, eukaryotic/virial (InterPro:IPR011899), Glutaredoxin subgroup (InterPro:IPR014025), Thioredoxin-like fold (InterPro:IPR012336); BEST Arabidopsis thaliana protein match is: Glutaredoxin family protein (TAIR:AT1G77370.1); Has 5770 Blast hits to 5765 proteins in 1222 species: Archae - 22; Bacteria - 2763; Metazoa - 448; Fungi - 348; Plants - 743; Viruses - 110; Other Eukaryotes - 1336 (source: NCBI BLink)."," "," ",2,2,0,0,0.152768706,0.182590449,0.156789188,0.13489313,0.099916296,0.077109081,0.057353543,0.047068539,0.047379722,0.044131344,0.107878737,0.15265727,0.160817669,0.123960981,0.104295782,0.083527369,0.128164431,0.039202519,0.048518869,0.050976373
AT1G22280,"Encodes a phytochrome-associated protein, PAPP2C (phytochrome-associated protein phosphatase type 2C).  PAPP2C interacts in the nucleus with phyA (phytochrome A) and phyB.  Functions as a regulator of phytochrome-interacting factor PIF3 by dephosphorylating phytochromes in the nucleus.","PHYTOCHROME-ASSOCIATED PROTEIN PHOSPHATASE TYPE 2C (PAPP2C)"," ",10,10,0,0,0.121579345,0.163585085,0.139700563,0.136130365,0.119882879,0.102358106,0.064545114,0.058253102,0.056641321,0.03732412,0.116055306,0.123876237,0.119709813,0.122592634,0.111675899,0.092375951,0.09961753,0.078877779,0.053494718,0.081724132
AT3G02875,"Hydrolyzes amino acid conjugates of the plant growth regulator indole-3-acetic acid (IAA), including IAA-Leu and IAA-Phe. Uses Mg and Co ions as cofactors.","IAA-LEUCINE RESISTANT 1 (ILR1)"," ",10,8,0,0,0.191330024,0.164512427,0.151085951,0.124691664,0.096716424,0.081183511,0.050103992,0.043262993,0.042023021,0.055089994,0.183814314,0.161844092,0.137222343,0.114872102,0.093290129,0.077097226,0.095544192,0.052021374,0.041782192,0.042512036
AT5G46540,"P-glycoprotein  7 (PGP7); FUNCTIONS IN: ATPase activity, coupled to transmembrane movement of substances; INVOLVED IN: transport, transmembrane transport; LOCATED IN: integral to membrane; EXPRESSED IN: 8 plant structures; EXPRESSED DURING: 4 anthesis, C globular stage, petal differentiation and expansion stage; CONTAINS InterPro DOMAIN/s: ATPase, AAA+ type, core (InterPro:IPR003593), ABC transporter-like (InterPro:IPR003439), ABC transporter, transmembrane domain, type 1 (InterPro:IPR011527), ABC transporter integral membrane type 1 (InterPro:IPR017940), ABC transporter, transmembrane domain (InterPro:IPR001140), ABC transporter, conserved site (InterPro:IPR017871); BEST Arabidopsis thaliana protein match is: P-glycoprotein  9 (TAIR:AT4G18050.1); Has 1807 Blast hits to 1807 proteins in 277 species: Archae - 0; Bacteria - 0; Metazoa - 736; Fungi - 347; Plants - 385; Viruses - 0; Other Eukaryotes - 339 (source: NCBI BLink).","ATP-BINDING CASSETTE B7 (ABCB7)"," ",3,3,0,0,0.061668282,0.069609421,0.097065614,0.11379043,0.128007882,0.09425,0.147717157,0.102136738,0.075467395,0.11028708,0.152299311,0.045179949,0.120713144,0.051321446,0.044877324,0.037232822,0.200562247,0.113571973,0.110133836,0.124107949
AT2G32670,"member of Synaptobrevin -like protein family","VESICLE-ASSOCIATED MEMBRANE PROTEIN 725 (VAMP725)"," ",2,2,0,0,0.046253231,0.035528501,0.033706806,0.04597397,0.050660577,0.099796279,0.164316076,0.166545685,0.198701573,0.158517301,0.038213456,0.028250276,0.026160851,0.036444975,0.053375658,0.072254628,0.276014822,0.10729606,0.197116628,0.164872646
AT5G37740,"Calcium-dependent lipid-binding (CaLB domain) family protein; FUNCTIONS IN: molecular_function unknown; INVOLVED IN: biological_process unknown; EXPRESSED IN: 22 plant structures; EXPRESSED DURING: 13 growth stages; CONTAINS InterPro DOMAIN/s: C2 membrane targeting protein (InterPro:IPR018029), C2 calcium/lipid-binding domain, CaLB (InterPro:IPR008973), C2 calcium-dependent membrane targeting (InterPro:IPR000008); BEST Arabidopsis thaliana protein match is: Calcium-dependent lipid-binding (CaLB domain) family protein (TAIR:AT1G66360.1)."," "," ",6,6,0,0,0.161354037,0.173510319,0.132263839,0.152166597,0.092568161,0.114879088,0.054403371,0.033054546,0.036980091,0.048819952,0.130392513,0.154847931,0.126657944,0.135032741,0.109127957,0.083115488,0.138995432,0.050593053,0.032550431,0.038686508
AT1G65020,"FUNCTIONS IN: molecular_function unknown; INVOLVED IN: biological_process unknown; LOCATED IN: endoplasmic reticulum, plasma membrane; EXPRESSED IN: 23 plant structures; EXPRESSED DURING: 13 growth stages; CONTAINS InterPro DOMAIN/s: NERD (InterPro:IPR011528); Has 69 Blast hits to 69 proteins in 27 species: Archae - 0; Bacteria - 18; Metazoa - 8; Fungi - 0; Plants - 36; Viruses - 0; Other Eukaryotes - 7 (source: NCBI BLink)."," "," ",10,11,0,0,0.131414692,0.127497186,0.155613318,0.11894638,0.11317706,0.097351439,0.074725789,0.06136662,0.062604465,0.05730305,0.11347751,0.121194313,0.114339966,0.108429517,0.093928559,0.082712349,0.128806064,0.087774662,0.085893652,0.063443409
AT3G54300,"Encodes a member of Synaptobrevin -like protein family. VAMP727 is a R-SNARE and interacts with SYP22/VTI11/SYP51. It is required for trafficking of storage proteins to the protein storage vacuoles (PSV) and also for PSV organization and biogenesis. Loss of function mutations have no phenotype but double mutants with SYP22 are embryo lethal.","VESICLE-ASSOCIATED MEMBRANE PROTEIN 727 (VAMP727)"," ",7,5,0,0,0.049823506,0.085258436,0.16819517,0.151748875,0.169221334,0.157189281,0.067457149,0.053307502,0.056624932,0.041173815,0.050211881,0.06483529,0.089557112,0.154027017,0.203034543,0.172263695,0.050136947,0.098095801,0.070175728,0.047661985
AT4G37640,"Encodes a calmodulin-regulated Ca(2+)-pump located in the endoplasmic reticulum.  Belongs to plant 2B ATPase's with an N-terminal autoinhibitor.","CALCIUM ATPASE 2 (ACA2)",ER,9,12,0,0,0.129586858,0.142607417,0.161180895,0.137649724,0.109666906,0.105535847,0.060306876,0.058374223,0.047108226,0.047983028,0.110405783,0.135888455,0.147768353,0.130660079,0.11137488,0.102229788,0.091569833,0.071660766,0.053467555,0.044974509
AT5G56660,"encodes IAA-amino acid hydrolase that has a broad range of substrate specificity. It is most active on IAA-Ala among the IAA-conjugate hydrolases tested.","IAA-LEUCINE RESISTANT (ILR)-LIKE 2 (ILL2)"," ",6,6,0,0,0.173771024,0.197775484,0.164879208,0.132222636,0.096303284,0.078634161,0.04322603,0.040263012,0.039167206,0.033757955,0.168669282,0.176059148,0.147030044,0.127237106,0.092180052,0.085063756,0.077591655,0.05942756,0.036086173,0.030655224
