AT4G00570,"Encodes an NAD-dependent malic enzyme (NAD-ME) that does not act on oxaloacetate, indicating that it belongs to EC 1.1.1.39. It is a member of the beta family of NAD-MEs in plants. It appears to function as a homodimer or as a heterodimer with the alpha-type NAD-ME2 (At2g13560). NAD-ME2 transcript and protein levels are higher during the night than during the day.","NAD-DEPENDENT MALIC ENZYME 2 (NAD-ME2)"," ",11,12,0,0,0.039780792,0.039241258,0.049319799,0.072762124,0.090072864,0.08205444,0.145579527,0.155891827,0.15928457,0.166012798,0.03060941,0.04222779,0.05209707,0.06100693,0.06296145,0.07937356,0.209562,0.1488313,0.1420797,0.1712508
AT3G51550,"Encodes a synergid-expressed, plasma-membrane localized receptor-like kinase that accumulates asymetrically in the synergid membrnane at the filiform apparatus and mediates male-female gametophyte interactions during pollen tube reception.  Also involved in powdery mildew infection.","FERONIA (FER)",PM,6,6,0,0,0.099753031,0.131142924,0.117391775,0.110991263,0.11190119,0.106531767,0.087340371,0.088799817,0.069229918,0.076917943,0.0983856,0.107052,0.1123471,0.1141795,0.1068166,0.09133076,0.1480137,0.06980579,0.07310336,0.07896557
AT1G20200,"EMBRYO DEFECTIVE 2719 (EMB2719); FUNCTIONS IN: enzyme regulator activity; INVOLVED IN: ubiquitin-dependent protein catabolic process, embryo development ending in seed dormancy; LOCATED IN: proteasome complex, plasma membrane, proteasome regulatory particle, lid subcomplex; EXPRESSED IN: 24 plant structures; EXPRESSED DURING: 13 growth stages; CONTAINS InterPro DOMAIN/s: Proteasome component (PCI) domain (InterPro:IPR000717), PCI/PINT associated module (InterPro:IPR013143), 26S proteasome regulatory subunit, C-terminal (InterPro:IPR013586); BEST Arabidopsis thaliana protein match is: PAM domain (PCI/PINT associated module) protein (TAIR:AT1G75990.1); Has 763 Blast hits to 760 proteins in 218 species: Archae - 0; Bacteria - 0; Metazoa - 312; Fungi - 164; Plants - 180; Viruses - 0; Other Eukaryotes - 107 (source: NCBI BLink).","EMBRYO DEFECTIVE 2719 (emb2719)"," ",3,3,0,0,0.084113961,0.091875977,0.100294887,0.096220594,0.075967108,0.08864895,0.123928679,0.123714523,0.115692281,0.099543039,0.1004857,0.08536354,0.07056101,0.08211466,0.06046207,0.05472897,0.1983015,0.1136073,0.1374898,0.09688534
AT1G20950,"Phosphofructokinase family protein; FUNCTIONS IN: diphosphate-fructose-6-phosphate 1-phosphotransferase activity; INVOLVED IN: response to fructose stimulus, response to sucrose stimulus, photosynthesis, response to glucose stimulus; LOCATED IN: pyrophosphate-dependent phosphofructokinase complex, alpha-subunit complex; EXPRESSED IN: 23 plant structures; EXPRESSED DURING: 13 growth stages; CONTAINS InterPro DOMAIN/s: Pyrophosphate-dependent phosphofructokinase PfpB (InterPro:IPR011183), Phosphofructokinase (InterPro:IPR000023); BEST Arabidopsis thaliana protein match is: Phosphofructokinase family protein (TAIR:AT1G76550.1); Has 4397 Blast hits to 4316 proteins in 1453 species: Archae - 20; Bacteria - 3299; Metazoa - 3; Fungi - 0; Plants - 433; Viruses - 0; Other Eukaryotes - 642 (source: NCBI BLink)."," "," ",5,4,0,0,0.084045387,0.071324285,0.050425957,0.062919773,0.047198705,0.072082322,0.12081907,0.154884318,0.167575466,0.168724717,0.09718999,0.05582353,0.03886335,0.04574962,0.04319757,0.0603965,0.1710679,0.1625438,0.1592188,0.165949
AT5G65750,"2-oxoglutarate dehydrogenase, E1 component; FUNCTIONS IN: oxoglutarate dehydrogenase (succinyl-transferring) activity, cobalt ion binding, zinc ion binding; INVOLVED IN: response to cadmium ion; LOCATED IN: mitochondrion; EXPRESSED IN: 23 plant structures; EXPRESSED DURING: 11 growth stages; CONTAINS InterPro DOMAIN/s: 2-oxoglutarate dehydrogenase, E1 component (InterPro:IPR011603), Dehydrogenase, E1 component (InterPro:IPR001017), Transketolase-like, pyrimidine-binding domain (InterPro:IPR005475); BEST Arabidopsis thaliana protein match is: 2-oxoglutarate dehydrogenase, E1 component (TAIR:AT3G55410.1); Has 1807 Blast hits to 1807 proteins in 277 species: Archae - 0; Bacteria - 0; Metazoa - 736; Fungi - 347; Plants - 385; Viruses - 0; Other Eukaryotes - 339 (source: NCBI BLink)."," "," ",12,11,0,0,0.039773971,0.0384809,0.057778733,0.085852357,0.093497472,0.104969771,0.124677108,0.14211791,0.157264349,0.155587429,0.03371929,0.04878276,0.06009207,0.06943904,0.09674382,0.1175053,0.122612,0.1390328,0.1446923,0.1673806
AT1G48760,"Encodes the putative delta subunit of the AP(adaptor protein)-3  complex and plays a role in vacuolar function.","DELTA-ADAPTIN (delta-ADR)"," ",2,2,0,1,0.205401097,0.127558453,0.095615143,0.08377346,0.062499552,0.056443003,0.096166559,0.097820324,0.081448496,0.093273913,0.3527412,0.192772,0.07777133,0.05813657,0.05188591,0.04805565,0.09484882,0.05992025,0,0.06386825
AT1G11860,"Glycine cleavage T-protein family; FUNCTIONS IN: aminomethyltransferase activity; INVOLVED IN: response to cadmium ion; LOCATED IN: in 6 components; EXPRESSED IN: 26 plant structures; EXPRESSED DURING: 15 growth stages; CONTAINS InterPro DOMAIN/s: Glycine cleavage system T protein (InterPro:IPR006223), Glycine cleavage T-protein, N-terminal (InterPro:IPR006222), Glycine cleavage T-protein, C-terminal barrel (InterPro:IPR013977); BEST Arabidopsis thaliana protein match is: Glycine cleavage T-protein family (TAIR:AT1G60990.3); Has 18524 Blast hits to 18520 proteins in 1978 species: Archae - 139; Bacteria - 5685; Metazoa - 432; Fungi - 162; Plants - 109; Viruses - 0; Other Eukaryotes - 11997 (source: NCBI BLink)."," "," ",5,7,0,0,0.036034199,0.043409973,0.061540015,0.066304178,0.083406447,0.099554667,0.133574644,0.132245787,0.182864314,0.161065776,0.06933292,0.04467622,0.04343435,0.05718075,0.06005768,0.07817891,0.1779775,0.1580091,0.1509112,0.1602414
AT5G11680,"FUNCTIONS IN: molecular_function unknown; INVOLVED IN: biological_process unknown; LOCATED IN: cytosol, plasma membrane; EXPRESSED IN: 26 plant structures; EXPRESSED DURING: 15 growth stages; CONTAINS InterPro DOMAIN/s: WW-domain-binding protein (InterPro:IPR018826); Has 1807 Blast hits to 1807 proteins in 277 species: Archae - 0; Bacteria - 0; Metazoa - 736; Fungi - 347; Plants - 385; Viruses - 0; Other Eukaryotes - 339 (source: NCBI BLink)."," "," ",3,4,0,0,0.079872184,0.050547741,0.099065541,0.137883681,0.15506986,0.11054503,0.092943558,0.106316099,0.086820418,0.080935888,0.08216368,0.09581374,0.1238448,0.1412358,0.1261086,0.1198271,0.09234796,0.07754522,0.08343299,0.05768011
AT1G67490,"Encodes an alpha-glucosidase I enzyme that catalyzes the first step in N-linked glycan processing. Localized to the endoplasmic reticulum (ER).","GLUCOSIDASE 1 (GCS1)",ER,7,7,0,0,0.10887291,0.111566062,0.122557371,0.137628259,0.114945692,0.091174178,0.121351748,0.067711305,0.063476343,0.060716132,0.09804657,0.1316915,0.1185733,0.120465,0.1118589,0.0857288,0.1068965,0.1044747,0.06717191,0.05509276
AT2G17790,"Encodes a protein with similarity to yeast VPS35 which encodes a component of the retromer involved in retrograde endosomal transport. Mutants partially suppress the loss of VTI11 function in Arabidopsis and restores gravitropism in the double mutant.","VPS35 HOMOLOG A (VPS35A)"," ",4,4,0,0,0.097608211,0.074437171,0.080892995,0.092054127,0.10081815,0.112421131,0.128108554,0.111902205,0.100889298,0.100868159,0.1114315,0.08275051,0.09119434,0.1157241,0.1586472,0.1201211,0.0747942,0.09283582,0.08332789,0.06917337
AT4G30440,"UDP-D-glucuronate 4-epimerase","UDP-D-GLUCURONATE 4-EPIMERASE 1 (GAE1)",Golgi,5,7,0,0,0.052511501,0.078655146,0.101989753,0.143787774,0.161245238,0.130525777,0.091527869,0.097076972,0.078576919,0.064103052,0.04158207,0.07419363,0.09435911,0.1160988,0.1223163,0.1107677,0.1473606,0.1113965,0.09944797,0.08247739
AT2G30880,"Pleckstrin homology (PH) domain-containing protein; FUNCTIONS IN: phosphoinositide binding; INVOLVED IN: signal transduction; LOCATED IN: plant-type cell wall; EXPRESSED IN: stem; CONTAINS InterPro DOMAIN/s: Pleckstrin homology-type (InterPro:IPR011993), Pleckstrin homology (InterPro:IPR001849); Has 8327 Blast hits to 6951 proteins in 819 species: Archae - 67; Bacteria - 1101; Metazoa - 4180; Fungi - 797; Plants - 557; Viruses - 16; Other Eukaryotes - 1609 (source: NCBI BLink)."," (SWAP70)"," ",2,2,1,1,0.227744706,0.201314742,0.155657015,0.097923039,0.102259573,0.058228174,0.059667839,0,0.048568481,0.048636431,0.1652774,0.1166227,0.05895279,0.06620278,0.04245435,0.0315468,0.1466341,0,0.1989408,0.1733682
AT2G03120,"homologous to Signal Peptide Peptidases (SPP), required for pollen development and pollen germination. No homozygotes could be recovered from a T-DNA insertion mutant.","SIGNAL PEPTIDE PEPTIDASE (SPP)",ER,3,3,0,0,0.147273222,0.118940768,0.154483912,0.156070302,0.127522549,0.114903972,0.032329818,0.046673108,0.051999717,0.049802631,0.09761892,0.1489977,0.1287642,0.1366711,0.1125112,0.1069982,0.1041823,0.0699221,0.05479398,0.03954026
AT5G12370,"exocyst complex component sec10 (SEC10); FUNCTIONS IN: molecular_function unknown; INVOLVED IN: exocytosis, vesicle docking; LOCATED IN: plasma membrane, membrane, exocyst; EXPRESSED IN: 24 plant structures; EXPRESSED DURING: 13 growth stages; CONTAINS InterPro DOMAIN/s: Exocyst complex component Sec10 (InterPro:IPR009976); Has 527 Blast hits to 483 proteins in 172 species: Archae - 0; Bacteria - 6; Metazoa - 178; Fungi - 247; Plants - 59; Viruses - 0; Other Eukaryotes - 37 (source: NCBI BLink).","EXOCYST COMPLEX COMPONENT SEC10 (SEC10)"," ",3,4,0,0,0.080484786,0.097626475,0.08972258,0.097470593,0.104272066,0.115763832,0.093214105,0.102168088,0.111764657,0.107512817,0.09049764,0.09090005,0.09779522,0.1010136,0.101382,0.09771032,0.1228703,0.08680923,0.08184129,0.1291804
AT5G63860,"UV-B-specific signaling component that orchestrates expression of a range of genes with vital UV-protective functions. Located in the nucleus and the cytosol. Associates with chromatin via histones. UV-B light promotes URV8 protein accumulation in the nucleus.","UVB-RESISTANCE 8 (UVR8)"," ",3,3,2,1,0.03733628,0,0,0.031998558,0.045585058,0.064250208,0.202188769,0.18452267,0.214501288,0.219617168,0.02058737,0.02320356,0.01184869,0,0.01908803,0.05009019,0.2217643,0.1833954,0.2023444,0.267678
AT4G11820,"Encodes a protein with hydroxymethylglutaryl-CoA synthase activity which was characterized by phenotypical complementation of the S. cerevisiae mutant.","HYDROXYMETHYLGLUTARYL-COA SYNTHASE (HMGS)"," ",3,3,0,0,0.075256499,0.039950462,0.03129396,0.034578557,0.053045305,0.048326441,0.13692756,0.157760933,0.230552404,0.192307879,0.06794721,0.04609895,0.01770693,0.02493972,0.0350816,0.03808885,0.1665517,0.1991115,0.186359,0.2181145
AT3G63260,"protein kinase, similar to mammal mixed-lineage kinase and Raf protein kinase"," (ATMRK1)"," ",4,5,0,0,0.037277696,0.095175699,0.06075867,0.045960795,0.045030807,0.024111552,0.181966991,0.169170751,0.180777815,0.159769225,0.01323992,0.01736622,0.0178226,0.01803736,0.01294782,0.008030168,0.1969243,0.2488394,0.2371486,0.2296437
AT1G14610,"Required for proper proliferation of basal cells.","TWIN 2 (TWN2)"," ",5,4,0,0,0.058807606,0.048761139,0.043229561,0.042833085,0.041439405,0.056620655,0.140796606,0.163801553,0.191117475,0.212592915,0.07659046,0.05012958,0.03699111,0.03985633,0.04847739,0.05064354,0.1110778,0.1739406,0.1909906,0.2213026
AT3G51050,"FG-GAP repeat-containing protein; FUNCTIONS IN: molecular_function unknown; INVOLVED IN: cell-matrix adhesion; LOCATED IN: integrin complex, integral to membrane, plasma membrane; EXPRESSED IN: 24 plant structures; EXPRESSED DURING: 13 growth stages; Has 99 Blast hits to 94 proteins in 41 species: Archae - 0; Bacteria - 0; Metazoa - 7; Fungi - 0; Plants - 47; Viruses - 0; Other Eukaryotes - 45 (source: NCBI BLink)."," "," ",4,6,0,0,0.07320618,0.10106197,0.120011689,0.133343515,0.128779919,0.119999739,0.090435571,0.085743472,0.076997297,0.070420647,0.067926,0.1061465,0.1111349,0.112359,0.100514,0.09478014,0.135864,0.09042772,0.1090192,0.07182856
AT5G58100,"unknown protein; INVOLVED IN: pollen exine formation; EXPRESSED IN: 19 plant structures; EXPRESSED DURING: 8 growth stages; BEST Arabidopsis thaliana protein match is: unknown protein (TAIR:AT3G28720.1); Has 35333 Blast hits to 34131 proteins in 2444 species: Archae - 798; Bacteria - 22429; Metazoa - 974; Fungi - 991; Plants - 531; Viruses - 0; Other Eukaryotes - 9610 (source: NCBI BLink)."," "," ",8,8,0,0,0.085330314,0.111232669,0.121820104,0.136502509,0.131285473,0.117049676,0.087269972,0.073054438,0.069419557,0.067035288,0.06109786,0.1165396,0.117315,0.1277053,0.1214302,0.1043823,0.1028538,0.08446465,0.09040547,0.07380583
AT1G19370,"unknown protein; LOCATED IN: endoplasmic reticulum; EXPRESSED IN: 22 plant structures; EXPRESSED DURING: 13 growth stages; BEST Arabidopsis thaliana protein match is: unknown protein (TAIR:AT1G75140.1); Has 45 Blast hits to 43 proteins in 15 species: Archae - 0; Bacteria - 0; Metazoa - 0; Fungi - 0; Plants - 44; Viruses - 0; Other Eukaryotes - 1 (source: NCBI BLink)."," "," ",4,3,0,0,0.099498098,0.146497509,0.147761966,0.151359173,0.11190012,0.088733806,0.069923858,0.06252847,0.063639635,0.058157364,0.1083174,0.1257118,0.1077155,0.1026358,0.06784862,0.05903557,0.1908728,0.07951805,0.06554245,0.09280192
AT5G10540,"Zincin-like metalloproteases family protein; FUNCTIONS IN: metalloendopeptidase activity; INVOLVED IN: response to cadmium ion, proteolysis; LOCATED IN: cytosol, apoplast, chloroplast; EXPRESSED IN: 24 plant structures; EXPRESSED DURING: 13 growth stages; CONTAINS InterPro DOMAIN/s: Peptidase M3A/M3B, thimet/oligopeptidase F (InterPro:IPR001567); BEST Arabidopsis thaliana protein match is: Zincin-like metalloproteases family protein (TAIR:AT5G65620.1); Has 30201 Blast hits to 17322 proteins in 780 species: Archae - 12; Bacteria - 1396; Metazoa - 17338; Fungi - 3422; Plants - 5037; Viruses - 0; Other Eukaryotes - 2996 (source: NCBI BLink)."," "," ",3,3,0,0,0.422836188,0.149896871,0.012640053,0.007355782,0.10823574,0.014728673,0.060724326,0.080686713,0.06928712,0.073608533,0.05468988,0.02678659,0.02217899,0.04084739,0.0490863,0.0766538,0.1564313,0.2146938,0.1829955,0.1756364
AT5G13360,"Auxin-responsive GH3 family protein; INVOLVED IN: response to auxin stimulus; LOCATED IN: cellular_component unknown; CONTAINS InterPro DOMAIN/s: GH3 auxin-responsive promoter (InterPro:IPR004993); BEST Arabidopsis thaliana protein match is: Auxin-responsive GH3 family protein (TAIR:AT5G13370.1)."," "," ",6,6,0,0,0.044426945,0.025847429,0.027676259,0.021326189,0.058846593,0.05576133,0.184265993,0.198807699,0.196313062,0.1867285,0.03936359,0.03002631,0.01699924,0.03437789,0.04531621,0.05516708,0.1875357,0.1809132,0.2018212,0.2084795
AT1G72750,"translocase inner membrane subunit 23-2 (TIM23-2); FUNCTIONS IN: protein transporter activity, P-P-bond-hydrolysis-driven protein transmembrane transporter activity; INVOLVED IN: intracellular protein transport, protein transport; LOCATED IN: mitochondrion, mitochondrial inner membrane, mitochondrial inner membrane presequence translocase complex, membrane; EXPRESSED IN: 23 plant structures; EXPRESSED DURING: 15 growth stages; CONTAINS InterPro DOMAIN/s: Mitochondrial inner membrane translocase complex, subunit Tim23 (InterPro:IPR005681), Mitochondrial inner membrane translocase complex, subunit Tim17/22 (InterPro:IPR003397); BEST Arabidopsis thaliana protein match is: translocase of inner mitochondrial membrane 23 (TAIR:AT1G17530.1); Has 613 Blast hits to 613 proteins in 178 species: Archae - 0; Bacteria - 0; Metazoa - 286; Fungi - 136; Plants - 143; Viruses - 0; Other Eukaryotes - 48 (source: NCBI BLink).","TRANSLOCASE INNER MEMBRANE SUBUNIT 23-2 (TIM23-2)",Mitochondrion,3,3,0,0,0.039762437,0.034848239,0.062408975,0.080356285,0.077134365,0.102912981,0.158559231,0.153234968,0.157235507,0.133547012,0.03353467,0.04217001,0.05073177,0.06086412,0.06740411,0.08403888,0.1345738,0.1747814,0.1670994,0.1848018
AT1G09330,"unknown protein; FUNCTIONS IN: molecular_function unknown; INVOLVED IN: biological_process unknown; LOCATED IN: integral to membrane; EXPRESSED IN: 24 plant structures; EXPRESSED DURING: 15 growth stages; CONTAINS InterPro DOMAIN/s: Protein of unknown function DUF846, eukaryotic (InterPro:IPR008564); Has 518 Blast hits to 518 proteins in 206 species: Archae - 0; Bacteria - 0; Metazoa - 193; Fungi - 145; Plants - 73; Viruses - 0; Other Eukaryotes - 107 (source: NCBI BLink)."," "," ",2,2,0,0,0.045269111,0.072604247,0.103203585,0.128315914,0.167772984,0.159059112,0.102538953,0.083884901,0.074204763,0.06314643,0.05835625,0.08961002,0.08698733,0.1513503,0.1739788,0.1818385,0.08691906,0.03526359,0.06348535,0.07221085
AT5G44790,"ATP dependent copper transporter vital for ethylene response pathway","RESPONSIVE-TO-ANTAGONIST 1 (RAN1)"," ",9,15,0,0,0.032624265,0.054182231,0.084323281,0.133448877,0.169972009,0.169988045,0.117550878,0.080249253,0.06825314,0.089408021,0.2408083,0.04705487,0.06846729,0.1062261,0.1204559,0.1094006,0.08827494,0.07972154,0.07141967,0.06817074
AT1G52780,"Protein of unknown function (DUF2921); FUNCTIONS IN: molecular_function unknown; INVOLVED IN: biological_process unknown; LOCATED IN: membrane; EXPRESSED IN: cultured cell, callus, leaf; CONTAINS InterPro DOMAIN/s: Protein of unknown function DUF2921 (InterPro:IPR021319); BEST Arabidopsis thaliana protein match is: Protein of unknown function (DUF2921) (TAIR:AT4G21700.1); Has 114 Blast hits to 99 proteins in 12 species: Archae - 0; Bacteria - 0; Metazoa - 0; Fungi - 0; Plants - 114; Viruses - 0; Other Eukaryotes - 0 (source: NCBI BLink)."," "," ",16,17,0,0,0.088635286,0.034147764,0.134950646,0.142533101,0.157708734,0.134643557,0.076268234,0.078950972,0.073927251,0.078234454,0.02643388,0.04711644,0.1507362,0.1311981,0.131487,0.1530902,0.1099298,0.08833393,0.09173261,0.06994187
AT4G33350,"Tic22-like family protein; LOCATED IN: chloroplast, chloroplast inner membrane, chloroplast envelope; EXPRESSED IN: 23 plant structures; EXPRESSED DURING: 13 growth stages; CONTAINS InterPro DOMAIN/s: Chloroplast protein import component Tic22 (InterPro:IPR005692), Tic22-like (InterPro:IPR007378); BEST Arabidopsis thaliana protein match is: Tic22-like family protein (TAIR:AT3G23710.1); Has 113 Blast hits to 113 proteins in 40 species: Archae - 0; Bacteria - 48; Metazoa - 0; Fungi - 0; Plants - 54; Viruses - 0; Other Eukaryotes - 11 (source: NCBI BLink).","TRANSLOCON AT THE INNER ENVELOPE MEMBRANE OF CHLOROPLASTS 22-IV (Tic22-IV)"," ",6,4,0,0,0.298044812,0.022820579,0.080913642,0.065293541,0.076647518,0.068963907,0.154546013,0.117599331,0.07231056,0.042860096,0.03580961,0.09477024,0.06332997,0.07917973,0.08456825,0.09843763,0.1902393,0.139261,0.1111183,0.103286
AT2G25790,"Leucine-rich receptor-like protein kinase family protein; FUNCTIONS IN: protein serine/threonine kinase activity, kinase activity, ATP binding; INVOLVED IN: transmembrane receptor protein tyrosine kinase signaling pathway, protein amino acid phosphorylation; LOCATED IN: plasma membrane; EXPRESSED IN: 23 plant structures; EXPRESSED DURING: 15 growth stages; CONTAINS InterPro DOMAIN/s: Protein kinase, catalytic domain (InterPro:IPR000719), Leucine-rich repeat-containing N-terminal domain, type 2 (InterPro:IPR013210), Leucine-rich repeat (InterPro:IPR001611), Serine/threonine-protein kinase-like domain (InterPro:IPR017442), Protein kinase-like domain (InterPro:IPR011009); BEST Arabidopsis thaliana protein match is: Leucine-rich repeat transmembrane protein kinase family protein (TAIR:AT4G28650.1); Has 153683 Blast hits to 57628 proteins in 1967 species: Archae - 59; Bacteria - 14832; Metazoa - 38909; Fungi - 1966; Plants - 84929; Viruses - 21; Other Eukaryotes - 12967 (source: NCBI BLink)."," "," ",2,2,0,1,0.187770507,0.11370323,0.139775206,0.137458487,0.116713723,0.088934905,0.059862529,0.084371014,0.03042751,0.040982888,0,0.1775809,0.1431244,0.1109585,0.1056472,0.076728,0.1510639,0.1476455,0.0264451,0.06080668
AT3G46290,"Encodes HERCULES1 (HERK1), a receptor kinase regulated by Brassinosteroids and required for cell elongation during vegetative growth.","HERCULES RECEPTOR KINASE 1 (HERK1)"," ",3,4,0,0,0.116990721,0.142555592,0.137273618,0.126558602,0.10416747,0.098310563,0.093440103,0.074253095,0.054284954,0.052165283,0.1168747,0.1308959,0.129709,0.1321639,0.1028911,0.08464611,0.117009,0.05068254,0.07041823,0.06470955
AT2G47060,"Encodes Pto-interacting 1-4 (PTI1-4), a member of the PTI1-like serine/threonine protein kinases that share strong sequence identity to the tomato PTI1 kinase.","PTO-INTERACTING 1-4 (PTI1-4)"," ",2,2,0,2,0.141628771,0.126483725,0.139221997,0.126492521,0.119256618,0.12258523,0.054708878,0.054574737,0.076105208,0.038942316,0.1564723,0.160793,0.1695635,0.1522093,0.1417655,0.1136607,0,0,0.06072378,0.04481189
AT1G22410,"Class-II DAHP synthetase family protein; FUNCTIONS IN: 3-deoxy-7-phosphoheptulonate synthase activity; INVOLVED IN: aromatic amino acid family biosynthetic process; LOCATED IN: membrane; EXPRESSED IN: 23 plant structures; EXPRESSED DURING: 15 growth stages; CONTAINS InterPro DOMAIN/s: DAHP synthetase, class II (InterPro:IPR002480); BEST Arabidopsis thaliana protein match is: 3-deoxy-D-arabino-heptulosonate 7-phosphate synthase 1 (TAIR:AT4G39980.1); Has 3811 Blast hits to 3796 proteins in 685 species: Archae - 0; Bacteria - 1237; Metazoa - 0; Fungi - 110; Plants - 171; Viruses - 0; Other Eukaryotes - 2293 (source: NCBI BLink)."," "," ",7,7,0,0,0.111511593,0.055667501,0.084197199,0.090679843,0.096262691,0.090460266,0.081992281,0.079921747,0.21988256,0.089424319,0.05058745,0.0511782,0.0630538,0.08708191,0.08873364,0.08472068,0.1153693,0.09860844,0.2168124,0.1438542
AT5G46630,"clathrin adaptor complexes medium subunit family protein, contains Pfam profile: PF00928 adaptor complexes medium subunit family; similar to micro-adaptins of clathrin coated vesicle adaptor complexes"," "," ",3,4,0,0,0.105631736,0.103908337,0.097852719,0.098806804,0.108785101,0.098692967,0.122246522,0.071357612,0.125417049,0.067301153,0.108369,0.1038166,0.104278,0.108172,0.07655789,0.07441975,0.140081,0.0999453,0.09920965,0.08515085
AT1G21630,"Calcium-binding EF hand family protein; FUNCTIONS IN: calcium ion binding; LOCATED IN: cytosol; EXPRESSED IN: 24 plant structures; EXPRESSED DURING: 15 growth stages; CONTAINS InterPro DOMAIN/s: EF-HAND 2 (InterPro:IPR018249), EPS15 homology (EH) (InterPro:IPR000261), Calcium-binding EF-hand (InterPro:IPR002048), EF-hand-like domain (InterPro:IPR011992); BEST Arabidopsis thaliana protein match is: Calcium-binding EF hand family protein (TAIR:AT1G20760.1)."," "," ",3,3,0,1,0.124378338,0.15001588,0.122107617,0.140595003,0.096509183,0.09236328,0.070640418,0.071703478,0.070662245,0.061024559,0.1208975,0.1482068,0.1287482,0.1496266,0.09154994,0.0975442,0,0.09000023,0.08864123,0.08478525
AT1G18450,"Encodes a gene similar to actin-related proteins in other organisms. Member of nuclear ARP family of genes. Component  of chromatin remodeling complexes, involved in chromatin-mediated gene regulation.  Phenotype of the arp4-1 mutant allele revealed partial sterility due to defects in anther development. Targeting the distinct, 3' UTR of AtARP4 transcripts with RNA interference caused a drastic reduction in the level of AtARP4 protein expression, and resulted in strong pleiotropic phenotypes such as altered organization of plant organs, early flowering, delayed flower senescence and high levels of sterility. Western blot analysis and immunolabelling demonstrated a clear correlation between reductions in the level of AtARP4 expression and severity of the phenotypes.","ACTIN-RELATED PROTEIN 4 (ARP4)"," ",3,3,0,0,0.030696632,0.047940597,0.074687779,0.079880406,0.0939444,0.097525523,0.153028372,0.165098942,0.148305798,0.108891552,0.04239775,0.08990401,0.09123157,0.06134764,0.08098607,0.08075679,0.1436669,0.125197,0.1171776,0.1673346
AT1G43580,"Sphingomyelin synthetase family protein; Has 50 Blast hits to 47 proteins in 19 species: Archae - 0; Bacteria - 0; Metazoa - 0; Fungi - 0; Plants - 42; Viruses - 0; Other Eukaryotes - 8 (source: NCBI BLink)."," "," ",2,2,1,1,0,0.23776555,0.156654969,0.14813345,0.136657264,0.124800213,0.071685432,0.022447282,0.052579419,0.049276421,0.1050812,0.1392872,0.1483683,0.1582118,0.145433,0.1040393,0,0.06461843,0.06168146,0.07327918
AT1G22360,"UDP-glucosyl transferase 85A2 (UGT85A2); FUNCTIONS IN: UDP-glycosyltransferase activity, transferase activity, transferring glycosyl groups, glucuronosyltransferase activity; INVOLVED IN: metabolic process; LOCATED IN: cellular_component unknown; EXPRESSED IN: 21 plant structures; EXPRESSED DURING: 11 growth stages; CONTAINS InterPro DOMAIN/s: UDP-glucuronosyl/UDP-glucosyltransferase (InterPro:IPR002213); BEST Arabidopsis thaliana protein match is: UDP-Glycosyltransferase superfamily protein (TAIR:AT1G22400.1); Has 7750 Blast hits to 7637 proteins in 383 species: Archae - 0; Bacteria - 124; Metazoa - 2215; Fungi - 30; Plants - 5218; Viruses - 99; Other Eukaryotes - 64 (source: NCBI BLink).","UDP-GLUCOSYL TRANSFERASE 85A2 (UGT85A2)"," ",3,4,0,0,0.061098129,0.04963764,0.032782764,0.055657551,0.066468053,0.015716547,0.206230342,0.116264148,0.23029255,0.165852275,0.06824068,0.02689699,0.0366834,0.03101229,0.04513361,0.08511938,0.191309,0.1628608,0.1820109,0.170733
AT1G53280,"Encodes a homolog of animal DJ-1 superfamily protein.  In the A. thaliana genome, three genes encoding close homologs of human DJ-1 were identified AT3G14990 (DJ1A), AT1G53280 (DJ1B) and AT4G34020 (DJ1C).  Among the three homologs, DJ1C is essential for chloroplast development and viability.","DJ-1 HOMOLOG B (DJ1B)"," ",3,3,0,0,0.038184373,0.054306131,0.070144147,0.053528129,0.110794199,0.16271889,0.126219293,0.126524872,0.122476343,0.135103623,0.04290994,0.03744294,0.04997173,0.06323827,0.1001231,0.1327136,0.09162822,0.1784256,0.1114776,0.192069
