AT1G45145,"encodes a cytosolic thioredoxin that reduces disulfide bridges of target proteins by the reversible formation of a disulfide bridge between two neighboring Cys residues present in the active site. Thioredoxins have been found to regulate a variety of biological reactions in prokaryotic and eukaryotic cells.","THIOREDOXIN H-TYPE 5 (TRX5)"," ",2,3,0,1,0.119985442,0.108531685,0.107409281,0.1282862,0.117156199,0.171856313,0.059728544,0.057593013,0.070243216,0.059210107,0.103144033,0.097176712,0.133047015,0.159349751,0.200666911,0.173286136,0.035271182,0,0.055285939,0.042772321
AT4G16450,"unknown protein; FUNCTIONS IN: molecular_function unknown; INVOLVED IN: photorespiration; LOCATED IN: mitochondrion, mitochondrial membrane, mitochondrial respiratory chain complex I, respiratory chain complex I, membrane; EXPRESSED IN: 25 plant structures; EXPRESSED DURING: 15 growth stages; Has 30201 Blast hits to 17322 proteins in 780 species: Archae - 12; Bacteria - 1396; Metazoa - 17338; Fungi - 3422; Plants - 5037; Viruses - 0; Other Eukaryotes - 2996 (source: NCBI BLink)."," ",Mitochondrion,2,2,0,0,0.034565413,0.040310614,0.059198339,0.073765579,0.103842408,0.12791783,0.12050239,0.147960886,0.149108676,0.142827866,0.038698765,0.054359822,0.062727322,0.083430668,0.112761607,0.122054352,0.084872656,0.157364747,0.150476948,0.133253113
AT1G53310,"Encodes one of four Arabidopsis phosphoenolpyruvate carboxylase proteins.","PHOSPHOENOLPYRUVATE CARBOXYLASE 1 (PPC1)"," ",3,3,0,0,0.105736392,0.049667172,0.045761042,0.032608168,0.017658526,0.022439283,0.113622616,0.178731362,0.180995314,0.252780125,0.120030655,0.068145564,0.04630075,0.044597872,0.067324529,0.052568576,0.121592137,0.119417097,0.179589452,0.180433368
AT5G26710,"Glutamyl/glutaminyl-tRNA synthetase, class Ic; FUNCTIONS IN: glutamate-tRNA ligase activity; INVOLVED IN: glutamyl-tRNA aminoacylation, translation, tRNA aminoacylation, tRNA aminoacylation for protein translation; LOCATED IN: cytoplasm; EXPRESSED IN: 24 plant structures; EXPRESSED DURING: 13 growth stages; CONTAINS InterPro DOMAIN/s: Aminoacyl-tRNA synthetase, class I, conserved site (InterPro:IPR001412), Glutamyl/glutaminyl-tRNA synthetase, class Ic, alpha-bundle domain (InterPro:IPR020061), Ribosomal protein L25/Gln-tRNA synthetase, beta-barrel domain (InterPro:IPR020056), Glutamyl/glutaminyl-tRNA synthetase, class Ic, N-terminal (InterPro:IPR020060), Ribosomal protein L25/Gln-tRNA synthetase, anti-codon-binding domain (InterPro:IPR011035), Glutamyl/glutaminyl-tRNA synthetase, class Ic, catalytic domain (InterPro:IPR020058), Glutamyl/glutaminyl-tRNA synthetase, class Ic (InterPro:IPR000924), Glutathione S-transferase, C-terminal-like (InterPro:IPR010987), Glutamyl-tRNA synthetase, class Ic, archaeal/eukaryotic cytosolic (InterPro:IPR004526), Glutamyl/glutaminyl-tRNA synthetase, class Ic, anti-codon binding domain (InterPro:IPR020059); BEST Arabidopsis thaliana protein match is: glutamine-tRNA ligase, putative / glutaminyl-tRNA synthetase, putative / GlnRS, putative (TAIR:AT1G25350.1); Has 14411 Blast hits to 14402 proteins in 2977 species: Archae - 262; Bacteria - 9488; Metazoa - 657; Fungi - 449; Plants - 238; Viruses - 0; Other Eukaryotes - 3317 (source: NCBI BLink)."," "," ",15,16,0,0,0.065414516,0.067771416,0.099896577,0.076702039,0.077714147,0.11036959,0.121233755,0.123303613,0.126079798,0.131514551,0.053376303,0.053610286,0.05780102,0.065471624,0.071635802,0.073516181,0.186952577,0.123016455,0.152576088,0.162043664
AT5G26667,"encodes a uridine 5'-monophosphate (UMP)/cytidine 5'-monophosphate (CMP) kinase."," (PYR6)"," ",3,3,0,0,0.254749855,0.027426753,0.034245088,0.057704607,0.022851497,0.030694052,0.164725073,0.025959462,0.178723725,0.202919888,0.04590325,0.044458847,0.033156224,0.03724697,0.025908991,0.064199471,0.215572262,0.192946563,0.171849809,0.168757613
AT5G63680,"Pyruvate kinase family protein; FUNCTIONS IN: pyruvate kinase activity, potassium ion binding, magnesium ion binding, catalytic activity; INVOLVED IN: response to cadmium ion, glycolysis; LOCATED IN: plasma membrane; EXPRESSED IN: 23 plant structures; EXPRESSED DURING: 13 growth stages; CONTAINS InterPro DOMAIN/s: Pyruvate kinase, C-terminal-like (InterPro:IPR015795), Pyruvate kinase, active site (InterPro:IPR018209), Pyruvate kinase, beta-barrel-like (InterPro:IPR011037), Pyruvate kinase, alpha/beta (InterPro:IPR015794), Pyruvate/Phosphoenolpyruvate kinase, catalytic core (InterPro:IPR015813), Pyruvate kinase (InterPro:IPR001697), Pyruvate kinase, barrel (InterPro:IPR015793); BEST Arabidopsis thaliana protein match is: Pyruvate kinase family protein (TAIR:AT5G08570.1); Has 10212 Blast hits to 10099 proteins in 2690 species: Archae - 168; Bacteria - 6017; Metazoa - 548; Fungi - 219; Plants - 540; Viruses - 0; Other Eukaryotes - 2720 (source: NCBI BLink)."," "," ",5,5,0,0,0.088086922,0.091872551,0.079281854,0.095609542,0.086687412,0.086344348,0.123567524,0.111588817,0.108338465,0.128622565,0.080750813,0.069308881,0.068263695,0.083284469,0.078085453,0.081939117,0.16662742,0.137923205,0.120574514,0.113242434
AT5G15490,"Encodes one of four UDP-glucose dehydrogenase UGD) genes.  Mutation of this gene in combination with UGD2 leads to swollen plant cell walls and severe developmental defects associated with changes in pectic polysaccharides.","UDP-GLUCOSE DEHYDROGENASE 3 (UGD3)"," ",3,3,0,0,0.053236232,0.047130931,0.069199685,0.03385281,0.035624306,0.095875918,0.151645307,0.198422317,0.145001686,0.170010808,0.072625793,0.039499039,0.039715501,0.042029172,0.040166589,0.048238159,0.117865396,0.201981306,0.176309426,0.22156962
AT5G52840,"NADH-ubiquinone oxidoreductase-related; FUNCTIONS IN: oxidoreductase activity, acting on NADH or NADPH; INVOLVED IN: photorespiration; LOCATED IN: mitochondrion, mitochondrial membrane, chloroplast, respiratory chain complex I, membrane; EXPRESSED IN: 22 plant structures; EXPRESSED DURING: 15 growth stages; CONTAINS InterPro DOMAIN/s: ETC complex I subunit (InterPro:IPR006806); BEST Arabidopsis thaliana protein match is: unknown protein (TAIR:AT4G28005.1); Has 30201 Blast hits to 17322 proteins in 780 species: Archae - 12; Bacteria - 1396; Metazoa - 17338; Fungi - 3422; Plants - 5037; Viruses - 0; Other Eukaryotes - 2996 (source: NCBI BLink)."," ",Mitochondrion,4,4,0,0,0.055221221,0.060190661,0.082108673,0.087616501,0.068908371,0.085273041,0.146935423,0.133318299,0.143417724,0.137010086,0.047413042,0.067663558,0.064710458,0.078286449,0.065334165,0.04932257,0.230310233,0.116058695,0.146061503,0.134839327
AT2G38960,"endoplasmic reticulum oxidoreductin","ENDOPLASMIC RETICULUM OXIDOREDUCTINS 2 (ERO2)"," ",2,3,0,1,0.193047499,0.129536945,0.163970115,0.152352492,0.104387393,0.089649301,0.050329887,0.039279575,0.042661721,0.034785073,0.172594941,0.202542109,0.178329018,0.157985817,0.108796285,0.075319765,0.03413443,0,0.029588673,0.040708964
AT4G37330,"member of CYP81D","CYTOCHROME P450, FAMILY 81, SUBFAMILY D, POLYPEPTIDE 4 (CYP81D4)"," ",5,5,0,0,0.068633712,0.10160818,0.106477762,0.101837141,0.104101254,0.126835178,0.070822569,0.144449106,0.088176029,0.087059068,0.076786864,0.098899917,0.103364476,0.109124832,0.105284271,0.116597632,0.081623045,0.130332112,0.086624964,0.091361887
AT5G54430,"Contains a universal stress protein domain. Protein is phosphorylated in response to Phytophthora infestans zoospores and xylanase."," (PHOS32)"," ",3,3,0,0,0.098795494,0.084370697,0.085845068,0.101309891,0.091469384,0.107789646,0.094042472,0.126334825,0.084851282,0.125191241,0.120245406,0.094665741,0.083076882,0.086094418,0.072210276,0.084713755,0.171304423,0.075825425,0.088179418,0.123684256
AT4G37390,"Encodes an IAA-amido synthase that conjugates Asp and other amino acids to auxin in vitro. Lines carrying insertions in this gene are hypersensitive to auxin. May function as a negative component in auxin signaling by regulating auxin activity."," (BRU6)"," ",7,7,0,0,0.059198058,0.074093902,0.076877524,0.063664061,0.072391076,0.083475914,0.133903925,0.139298309,0.139838977,0.157258256,0.061777534,0.055701573,0.058250085,0.075939734,0.090787938,0.078806168,0.13601985,0.134120855,0.152641207,0.155955057
AT5G47910,"NADPH/respiratory burst oxidase protein D (RbohD).Interacts with AtrbohF gene to fine tune the spatial control of ROI production and hypersensitive response to cell in and around infection site.","RESPIRATORY BURST OXIDASE HOMOLOGUE D (RBOHD)"," ",16,19,0,0,0.099470727,0.107071557,0.122205504,0.116367384,0.119205454,0.103849381,0.085857199,0.061160276,0.095936967,0.088875551,0.092625624,0.115556991,0.113914166,0.121550431,0.119500813,0.096799911,0.115065368,0.066364419,0.067757161,0.090865115
AT4G01610,"Cysteine proteinases superfamily protein; FUNCTIONS IN: cysteine-type endopeptidase activity, cysteine-type peptidase activity; INVOLVED IN: proteolysis, regulation of catalytic activity; LOCATED IN: vacuole; EXPRESSED IN: 22 plant structures; EXPRESSED DURING: 13 growth stages; CONTAINS InterPro DOMAIN/s: Peptidase C1A, papain (InterPro:IPR013128), Peptidase C1A, cathepsin B (InterPro:IPR015643), Peptidase C1A, papain C-terminal (InterPro:IPR000668), Peptidase, cysteine peptidase active site (InterPro:IPR000169), Peptidase C1A, propeptide (InterPro:IPR012599); BEST Arabidopsis thaliana protein match is: Cysteine proteinases superfamily protein (TAIR:AT1G02305.1); Has 7486 Blast hits to 7443 proteins in 692 species: Archae - 63; Bacteria - 158; Metazoa - 3254; Fungi - 4; Plants - 1745; Viruses - 146; Other Eukaryotes - 2116 (source: NCBI BLink)."," "," ",5,7,0,0,0.100115348,0.111088571,0.094000414,0.091211162,0.091825149,0.09158386,0.116552286,0.103611765,0.110409009,0.089602436,0.098110109,0.098535648,0.094045183,0.098071997,0.104675149,0.103705433,0.073651202,0.082174494,0.149684047,0.097346738
AT2G32260,"phosphorylcholine cytidylyltransferase (CCT1); CONTAINS InterPro DOMAIN/s: Rossmann-like alpha/beta/alpha sandwich fold (InterPro:IPR014729), Cytidyltransferase-related (InterPro:IPR004821), Cytidylyltransferase (InterPro:IPR004820); BEST Arabidopsis thaliana protein match is: phosphorylcholine cytidylyltransferase2 (TAIR:AT4G15130.1); Has 2466 Blast hits to 2109 proteins in 632 species: Archae - 27; Bacteria - 791; Metazoa - 538; Fungi - 333; Plants - 250; Viruses - 5; Other Eukaryotes - 522 (source: NCBI BLink).","PHOSPHORYLCHOLINE CYTIDYLYLTRANSFERASE (CCT1)"," ",3,5,1,1,0.122434001,0.146206233,0.147086567,0.124430621,0.113187995,0.136176609,0.08941267,0,0.064130221,0.056935083,0.14671332,0.105772687,0.089824174,0.070757965,0.075093332,0.103834633,0.325783167,0,0.050423466,0.031797257
AT3G17820,"encodes a cytosolic glutamine synthetase, the enzyme has low affinity with substrate ammonium","GLUTAMINE SYNTHETASE 1.3 (GLN1.3)",Cytosol,2,5,0,0,0.075036908,0.031820083,0.025581582,0.04211241,0.05819084,0.067084259,0.148597537,0.156653387,0.191454563,0.20346843,0.06697677,0.043811861,0.041345366,0.044684963,0.066620956,0.079965223,0.221938299,0.118454876,0.166512614,0.149689072
AT5G09400,"potassium transporter","K+ UPTAKE PERMEASE 7 (KUP7)"," ",4,2,0,0,0.304763207,0.172090271,0.107056294,0.081695421,0.066883557,0.046211203,0.051754034,0.041364049,0.065971028,0.062210936,0.410023926,0.190058597,0.091337323,0.058612289,0.042827433,0.030624613,0.106268002,0.030785757,0.022110412,0.017351648
AT5G56970,"It encodes a protein whose sequence is similar to cytokinin oxidase/dehydrogenase, which catalyzes the degradation of cytokinins.","CYTOKININ OXIDASE 3 (CKX3)"," ",6,7,0,0,0.156510171,0.112536807,0.137871838,0.148427625,0.108186594,0.09180908,0.056410346,0.065162626,0.066124414,0.056960498,0.107671549,0.116632876,0.101176155,0.085272193,0.072683312,0.065341287,0.14065839,0.103850305,0.104494164,0.102219769
AT2G25430,"epsin N-terminal homology (ENTH) domain-containing protein / clathrin assembly protein-related; FUNCTIONS IN: phospholipid binding, clathrin binding, binding, phosphatidylinositol binding; INVOLVED IN: clathrin coat assembly; LOCATED IN: nucleus, plasma membrane; EXPRESSED IN: 23 plant structures; EXPRESSED DURING: 13 growth stages; CONTAINS InterPro DOMAIN/s: Epsin-like, N-terminal (InterPro:IPR013809), Clathrin adaptor, phosphoinositide-binding, GAT-like (InterPro:IPR014712), ANTH (InterPro:IPR011417), ENTH/VHS (InterPro:IPR008942); BEST Arabidopsis thaliana protein match is: ENTH/ANTH/VHS superfamily protein (TAIR:AT4G32285.2); Has 1786 Blast hits to 1328 proteins in 221 species: Archae - 4; Bacteria - 135; Metazoa - 673; Fungi - 126; Plants - 678; Viruses - 2; Other Eukaryotes - 168 (source: NCBI BLink)."," "," ",2,2,1,2,0.173177763,0.112689004,0.106298041,0.112559977,0.115767832,0.102670655,0.055751223,0,0.076675498,0.144410008,0.162043085,0.144281102,0.13942657,0.136415875,0.106630037,0.121417026,0,0.101311747,0,0.088474558
AT3G54030,"Protein kinase protein with tetratricopeptide repeat domain; FUNCTIONS IN: binding, protein kinase activity, kinase activity, ATP binding; INVOLVED IN: protein amino acid phosphorylation, N-terminal protein myristoylation; LOCATED IN: plasma membrane; EXPRESSED IN: 23 plant structures; EXPRESSED DURING: 13 growth stages; CONTAINS InterPro DOMAIN/s: Tetratricopeptide-like helical (InterPro:IPR011990), Protein kinase, catalytic domain (InterPro:IPR000719), Serine-threonine/tyrosine-protein kinase (InterPro:IPR001245), Protein kinase-like domain (InterPro:IPR011009); BEST Arabidopsis thaliana protein match is: Protein kinase protein with tetratricopeptide repeat domain (TAIR:AT5G59010.1); Has 33259 Blast hits to 32742 proteins in 1298 species: Archae - 16; Bacteria - 2417; Metazoa - 7041; Fungi - 251; Plants - 21929; Viruses - 104; Other Eukaryotes - 1501 (source: NCBI BLink)."," "," ",3,3,0,1,0.144453357,0.157469549,0.122183822,0.121316325,0.100312968,0.08100664,0.086927156,0.058267142,0.055907896,0.072155145,0.144145784,0.139872969,0.108210119,0.109218166,0.091281776,0.078801634,0.195776024,0.068825427,0,0.063868102
AT3G57010,"Calcium-dependent phosphotriesterase superfamily protein; FUNCTIONS IN: strictosidine synthase activity; INVOLVED IN: alkaloid biosynthetic process, biosynthetic process; LOCATED IN: endoplasmic reticulum; EXPRESSED IN: 9 plant structures; EXPRESSED DURING: 4 anthesis, petal differentiation and expansion stage; CONTAINS InterPro DOMAIN/s: Strictosidine synthase (InterPro:IPR004141), Strictosidine synthase, conserved region (InterPro:IPR018119), Six-bladed beta-propeller, TolB-like (InterPro:IPR011042); BEST Arabidopsis thaliana protein match is: Calcium-dependent phosphotriesterase superfamily protein (TAIR:AT3G57020.1); Has 984 Blast hits to 970 proteins in 187 species: Archae - 1; Bacteria - 187; Metazoa - 221; Fungi - 0; Plants - 480; Viruses - 0; Other Eukaryotes - 95 (source: NCBI BLink)."," "," ",6,6,0,0,0.103682629,0.117103139,0.138081812,0.142672685,0.116940828,0.10549765,0.090780393,0.069194329,0.061953044,0.05409349,0.104914096,0.1243073,0.119391912,0.122380486,0.125911461,0.089088393,0.102289191,0.073361988,0.067911953,0.070443219
AT5G41790,"encodes a protein that physically interacts specifically with the putative coiled-coil region of COP1 in vitro. In hypocotyl and cotyledon protoplasts, it is associated to the cytoskeleton, but not in the root. expression is not regulated by light.","COP1-INTERACTIVE PROTEIN 1 (CIP1)"," ",5,9,0,0,0.104283042,0.040817097,0.040572629,0.033639086,0.065233201,0.024828772,0.135726401,0.192379527,0.14941571,0.213104537,0.043247381,0.024105328,0.201646876,0.012347838,0.009710885,0.161131685,0.060303353,0.096642547,0.089217976,0.30164613
AT2G38760,"Annexins are calcium binding proteins that are localized in the cytoplasm. When cytosolic Ca2+ increases, they relocate to the plasma membrane.","ANNEXIN 3 (ANNAT3)"," ",5,5,0,1,0.112502239,0.080944047,0.085054045,0.077774503,0.063043027,0.076260115,0.130874313,0.117374071,0.140664194,0.115509447,0.191946644,0.160601065,0.112809957,0.126618621,0.069539501,0.067563914,0,0.090886,0.099848591,0.080185706
AT1G72550,"tRNA synthetase beta subunit family protein; FUNCTIONS IN: phenylalanine-tRNA ligase activity, RNA binding, magnesium ion binding, nucleotide binding, ATP binding; INVOLVED IN: phenylalanyl-tRNA aminoacylation, translation; LOCATED IN: phenylalanine-tRNA ligase complex, cytoplasm; EXPRESSED IN: 23 plant structures; EXPRESSED DURING: 14 growth stages; CONTAINS InterPro DOMAIN/s: Putative DNA binding domain (InterPro:IPR009061), tRNA synthetase, B5 (InterPro:IPR005147), Phenylalanyl-tRNA synthetase, class IIc, beta subunit, archae/euk cytosolic (InterPro:IPR004531), B3/B4 tRNA-binding domain (InterPro:IPR005146); Has 6477 Blast hits to 6464 proteins in 2647 species: Archae - 257; Bacteria - 4445; Metazoa - 257; Fungi - 153; Plants - 56; Viruses - 0; Other Eukaryotes - 1309 (source: NCBI BLink)."," "," ",11,11,0,0,0.044894197,0.052052709,0.060924545,0.056625269,0.079522424,0.091485993,0.14142569,0.154512868,0.159260087,0.159296219,0.045365801,0.039956557,0.050790812,0.057902637,0.068334208,0.083419212,0.131135547,0.204543611,0.16381165,0.154739965
AT3G61990,"Encodes a protein methyltransferase. Involved in the methylation of plant transmembrane proteins.","O-MTASE FAMILY 3 PROTEIN (OMTF3)",ER,2,2,0,0,0.071316314,0.078092816,0.062772402,0.052580087,0.042473086,0.032044971,0.16295138,0.164351024,0.169600341,0.16381758,0.049176665,0.0550271,0.048051461,0.042832011,0.034190795,0.078374198,0.296087442,0.160885878,0.124997381,0.110377068
AT5G45510,"Leucine-rich repeat (LRR) family protein; INVOLVED IN: defense response; LOCATED IN: cytosol; EXPRESSED IN: 22 plant structures; EXPRESSED DURING: 13 growth stages; CONTAINS InterPro DOMAIN/s: Disease resistance protein (InterPro:IPR000767); BEST Arabidopsis thaliana protein match is: NB-ARC domain-containing disease resistance protein (TAIR:AT4G19050.1); Has 30201 Blast hits to 17322 proteins in 780 species: Archae - 12; Bacteria - 1396; Metazoa - 17338; Fungi - 3422; Plants - 5037; Viruses - 0; Other Eukaryotes - 2996 (source: NCBI BLink)."," "," ",18,18,0,0,0.086366202,0.12150844,0.130735554,0.109216933,0.11312451,0.122683255,0.078756562,0.090348673,0.057292104,0.089967767,0.085010905,0.097840455,0.11256428,0.1174726,0.11211156,0.106876591,0.136319348,0.085300743,0.081442542,0.065060977
AT3G20410,"calmodulin-domain protein kinase CDPK isoform 9 (CPK9)","CALMODULIN-DOMAIN PROTEIN KINASE 9 (CPK9)",PM,3,4,0,0,0.16015262,0.091452277,0.124251489,0.152236125,0.112117235,0.08451093,0.096647655,0.060569132,0.061101442,0.056961095,0.122133644,0.132602457,0.13376433,0.124680752,0.101756485,0.088383994,0.077248239,0.084586327,0.068874901,0.06596887
AT2G36880,"methionine adenosyltransferase 3 (MAT3); FUNCTIONS IN: copper ion binding, methionine adenosyltransferase activity; INVOLVED IN: one-carbon metabolic process, S-adenosylmethionine biosynthetic process; LOCATED IN: plasma membrane; EXPRESSED IN: 27 plant structures; EXPRESSED DURING: 17 growth stages; CONTAINS InterPro DOMAIN/s: S-adenosylmethionine synthetase (InterPro:IPR002133), S-adenosylmethionine synthetase superfamily (InterPro:IPR022636), S-adenosylmethionine synthetase, N-terminal (InterPro:IPR022628), S-adenosylmethionine synthetase, C-terminal (InterPro:IPR022630), S-adenosylmethionine synthetase, conserved site (InterPro:IPR022631), S-adenosylmethionine synthetase, central domain (InterPro:IPR022629); BEST Arabidopsis thaliana protein match is: S-adenosylmethionine synthetase family protein (TAIR:AT3G17390.1); Has 10904 Blast hits to 10897 proteins in 2898 species: Archae - 12; Bacteria - 5503; Metazoa - 373; Fungi - 167; Plants - 705; Viruses - 1; Other Eukaryotes - 4143 (source: NCBI BLink).","METHIONINE ADENOSYLTRANSFERASE 3 (MAT3)"," ",5,8,0,0,0.031251855,0.02765219,0.034107075,0.051135237,0.085129282,0.108008677,0.162277858,0.169376257,0.160980028,0.170081541,0.043118441,0.034648206,0.045334357,0.063423301,0.080214534,0.103925698,0.121642807,0.149331264,0.165091442,0.19326995
AT3G51440,"Calcium-dependent phosphotriesterase superfamily protein; FUNCTIONS IN: strictosidine synthase activity; INVOLVED IN: alkaloid biosynthetic process, biosynthetic process; LOCATED IN: endoplasmic reticulum; EXPRESSED IN: 19 plant structures; EXPRESSED DURING: 10 growth stages; CONTAINS InterPro DOMAIN/s: Strictosidine synthase, conserved region (InterPro:IPR018119), Strictosidine synthase (InterPro:IPR004141), Six-bladed beta-propeller, TolB-like (InterPro:IPR011042); BEST Arabidopsis thaliana protein match is: Calcium-dependent phosphotriesterase superfamily protein (TAIR:AT3G51430.1); Has 1624 Blast hits to 1611 proteins in 398 species: Archae - 36; Bacteria - 672; Metazoa - 222; Fungi - 24; Plants - 455; Viruses - 0; Other Eukaryotes - 215 (source: NCBI BLink)."," "," ",3,3,0,0,0.128061876,0.104452029,0.185327686,0.129904898,0.091655535,0.084818547,0.083927995,0.044721818,0.068053115,0.079076501,0.119947972,0.151518368,0.153043053,0.127654727,0.108160047,0.110923158,0.032051268,0.066337525,0.065895215,0.064468667
AT5G41280,"Receptor-like protein kinase-related family protein; FUNCTIONS IN: molecular_function unknown; INVOLVED IN: biological_process unknown; LOCATED IN: anchored to plasma membrane, anchored to membrane; EXPRESSED IN: hypocotyl, root, callus; CONTAINS InterPro DOMAIN/s: Protein of unknown function DUF26 (InterPro:IPR002902); BEST Arabidopsis thaliana protein match is: Receptor-like protein kinase-related family protein (TAIR:AT5G41290.1); Has 1807 Blast hits to 1807 proteins in 277 species: Archae - 0; Bacteria - 0; Metazoa - 736; Fungi - 347; Plants - 385; Viruses - 0; Other Eukaryotes - 339 (source: NCBI BLink)."," "," ",2,2,0,0,0.189597624,0.087549253,0.128679877,0.086579921,0.128065901,0.130623948,0.057340925,0.09479592,0.048702457,0.048064174,0.102555247,0.13664886,0.176094029,0.128840508,0.123945626,0.135754044,0.079050907,0.053980803,0.038572026,0.02455795
AT3G21250,"member of MRP subfamily","ATP-BINDING CASSETTE C8 (ABCC8)"," ",5,7,0,1,0.326595266,0.186931119,0.11722909,0.090111583,0.065584113,0.059920929,0.039313684,0.035162774,0.050733116,0.028418326,0.263611001,0.154280917,0.073668276,0.041829265,0.044737596,0.047361703,0.041476324,0,0.140082526,0.192952392
AT2G17420,"NADPH-dependent thioredoxin reductase, major cytosolic isoform","NADPH-DEPENDENT THIOREDOXIN REDUCTASE A (NTRA)"," ",5,5,0,0,0.084726764,0.080534848,0.032717128,0.091150489,0.051387527,0.062207462,0.136594922,0.154984069,0.152729009,0.152967782,0.033128626,0.09494767,0.088410682,0.08742932,0.084049265,0.079062244,0.177738618,0.127164193,0.091585938,0.136483445
AT1G04980,"Encodes a protein disulfide isomerase-like (PDIL) protein, a member of a multigene family within the thioredoxin (TRX) superfamily. Transcript levels for this gene are up-regulated in response to three different chemical inducers of ER stress (dithiothreitol, beta-mercaptoethanol, and tunicamycin). AtIRE1-2 does not appear to be required for this response, but the atbzip60 mutant has a diminished response.","PDI-LIKE 2-2 (PDIL2-2)"," ",5,6,0,0,0.157311626,0.179971736,0.153995249,0.144617594,0.115839338,0.0880091,0.050137396,0.035493846,0.026946547,0.047677569,0.1718211,0.18086075,0.15356715,0.119133833,0.09668628,0.076051282,0.063749223,0.045345741,0.042337361,0.050447281
AT4G25630,"encodes a fibrillarin, a key nucleolar protein in eukaryotes which associates with box C/D small nucleolar RNAs (snoRNAs) directing 2'-O-ribose methylation of the rRNA. This gene also encodes a novel box C/D snoRNA, U60.2f in its fifth intron that accumulates in seedlings and that their targeted residue on the 25 S rRNA is methylated.","FIBRILLARIN 2 (FIB2)"," ",2,2,0,0,0.083889372,0.089295534,0.112572883,0.131564848,0.138067664,0.14953491,0.090535317,0.064838714,0.075459876,0.064240882,0.085693256,0.103637656,0.103919879,0.109783979,0.12377498,0.096561605,0.045442775,0.114598305,0.099016118,0.117571448
AT1G14830,"Encodes a dynamin-like protein that is involved in mitochondrial morphogenesis and pollen development. Protein is localized as speckles in the cytoplasm, partially co-localizes with mitochondrial markers, cell plate of dividing cells, and the tip of root hairs, root cap cells, and expanding part of trichoblasts.","DYNAMIN-LIKE 1C (DL1C)",PM,13,14,0,0,0.108285336,0.111346291,0.129024541,0.11623494,0.113334856,0.109860128,0.083154259,0.080638203,0.073091497,0.07502995,0.10102907,0.111693591,0.115321657,0.109976171,0.107993527,0.099024257,0.135092115,0.073104258,0.077243393,0.069521961
AT3G12290,"Amino acid dehydrogenase family protein; FUNCTIONS IN: binding, catalytic activity; INVOLVED IN: folic acid and derivative biosynthetic process, metabolic process; LOCATED IN: chloroplast; EXPRESSED IN: 25 plant structures; EXPRESSED DURING: 14 growth stages; CONTAINS InterPro DOMAIN/s: Tetrahydrofolate dehydrogenase/cyclohydrolase, NAD(P)-binding domain (InterPro:IPR020631), Tetrahydrofolate dehydrogenase/cyclohydrolase (InterPro:IPR000672), NAD(P)-binding domain (InterPro:IPR016040), Tetrahydrofolate dehydrogenase/cyclohydrolase, conserved site (InterPro:IPR020867), Tetrahydrofolate dehydrogenase/cyclohydrolase, catalytic domain (InterPro:IPR020630); BEST Arabidopsis thaliana protein match is: Amino acid dehydrogenase family protein (TAIR:AT4G00620.1); Has 9969 Blast hits to 9964 proteins in 2781 species: Archae - 105; Bacteria - 5648; Metazoa - 394; Fungi - 308; Plants - 157; Viruses - 0; Other Eukaryotes - 3357 (source: NCBI BLink)."," "," ",4,6,0,0,0.108641312,0.099199525,0.057534773,0.044824554,0.059102329,0.073741917,0.153433057,0.130892218,0.144652333,0.127977981,0.074577333,0.064133209,0.058657508,0.066603468,0.068766912,0.068296825,0.16701177,0.151285078,0.144175012,0.136492885
